{
  "result_id": "doppler_effect_classical",
  "result_name": "Classical Doppler Effect",
  "result_equations": [
    {
      "id": "eq1",
      "equation": "f' = f (v_wave +- v_observer)/(v_wave +- v_source)"
    },
    {
      "id": "eq2",
      "equation": "f' = f (1 +- v/v_wave) (moving source, stationary observer)"
    }
  ],
  "explanation": "The Classical Doppler effect describes the change in frequency of waves when there is relative motion between the source and observer. When the source and observer approach each other, the frequency increases; when they recede, it decreases. This effect applies to sound waves, water waves, and other classical waves, differing from the relativistic Doppler effect for light.",
  "equations_assumptions": [
    {
      "id": "eq_assump1",
      "text": "The wave speed is constant in the medium and much larger than source/observer speeds."
    },
    {
      "id": "eq_assump2",
      "text": "Motion is along the line connecting source and observer."
    },
    {
      "id": "eq_assump3",
      "text": "Classical mechanics applies (non-relativistic velocities)."
    }
  ],
  "definitions": [
    {
      "symbol": "f'",
      "definition": "Observed frequency after Doppler shift."
    },
    {
      "symbol": "f",
      "definition": "Original frequency emitted by the source."
    },
    {
      "symbol": "v_wave",
      "definition": "Speed of waves in the medium."
    },
    {
      "symbol": "v_observer",
      "definition": "Speed of observer (positive when moving toward source)."
    },
    {
      "symbol": "v_source",
      "definition": "Speed of source (positive when moving toward observer)."
    },
    {
      "symbol": "v",
      "definition": "Relative velocity between source and observer."
    }
  ],
  "derivation": [
    {
      "step": 1,
      "equation": "lambda = v_wave/f"
    },
    {
      "step": 2,
      "equation": "Case 1: Moving observer, stationary source"
    },
    {
      "step": 3,
      "equation": "v_relative = v_wave + v_observer"
    },
    {
      "step": 4,
      "equation": "f' = v_relative/lambda = (v_wave + v_observer)/(v_wave/f)"
    },
    {
      "step": 5,
      "equation": "f' = f (v_wave + v_observer)/v_wave"
    },
    {
      "step": 6,
      "equation": "Case 2: Moving source, stationary observer"
    },
    {
      "step": 7,
      "equation": "lambda' = (v_wave - v_source)/f"
    },
    {
      "step": 8,
      "equation": "f' = v_wave/lambda' = v_wave f/(v_wave - v_source)"
    },
    {
      "step": 9,
      "equation": "General case: f' = f (v_wave +- v_observer)/(v_wave +- v_source)"
    }
  ],
  "derivation_assumptions": [
    {
      "id": "assumption1",
      "text": "The medium is stationary relative to the chosen reference frame."
    },
    {
      "id": "assumption2",
      "text": "Wave propagation is linear and the medium is non-dispersive."
    }
  ],
  "derivation_explanation": [
    {
      "step": 1,
      "text": "Start with the basic wave relation between wavelength, frequency, and wave speed."
    },
    {
      "step": 2,
      "text": "Consider first the case where only the observer is moving."
    },
    {
      "step": 3,
      "text": "The relative speed between waves and observer changes the effective wave speed."
    },
    {
      "step": 4,
      "text": "The observed frequency is the relative speed divided by wavelength."
    },
    {
      "step": 5,
      "text": "Substitute to get the frequency shift for moving observer."
    },
    {
      "step": 6,
      "text": "Now consider the case where only the source is moving."
    },
    {
      "step": 7,
      "text": "A moving source changes the effective wavelength of the emitted waves."
    },
    {
      "step": 8,
      "text": "The observed frequency uses the modified wavelength but unchanged wave speed."
    },
    {
      "step": 9,
      "text": "Combine both effects for the general case with both source and observer moving."
    }
  ],
  "programmatic_verification": {
    "language": "python 3.11.12",
    "library": "sympy 1.12.0",
    "code": [
      "import sympy as sp",
      "# Define symbols",
      "f, f_prime, v_wave, v_obs, v_src = sp.symbols('f f_prime v_wave v_obs v_src', real=True)",
      "# General Doppler formula",
      "f_doppler = f * (v_wave + v_obs) / (v_wave + v_src)",
      "# Test specific cases",
      "# Case 1: Stationary source, moving observer",
      "f_moving_obs = f_doppler.subs(v_src, 0)",
      "expected_moving_obs = f * (v_wave + v_obs) / v_wave",
      "assert sp.simplify(f_moving_obs - expected_moving_obs) == 0",
      "# Case 2: Moving source, stationary observer",
      "f_moving_src = f_doppler.subs(v_obs, 0)",
      "expected_moving_src = f * v_wave / (v_wave + v_src)",
      "assert sp.simplify(f_moving_src - expected_moving_src) == 0",
      "# Case 3: Both stationary (no Doppler shift)",
      "f_no_motion = f_doppler.subs([(v_obs, 0), (v_src, 0)])",
      "assert f_no_motion == f",
      "# Verify approaching vs receding",
      "# Approaching: positive velocities increase frequency",
      "f_approach = f_doppler.subs([(v_obs, 10), (v_src, -10), (v_wave, 340), (f, 1000)])",
      "assert f_approach > 1000  # frequency increases",
      "# Receding: negative relative velocity decreases frequency",
      "f_recede = f_doppler.subs([(v_obs, -10), (v_src, 10), (v_wave, 340), (f, 1000)])",
      "assert f_recede < 1000  # frequency decreases",
      "# Small velocity approximation",
      "v_small = sp.symbols('v_small', real=True)",
      "f_approx = f_doppler.subs([(v_obs, v_small), (v_src, 0)])",
      "f_series = sp.series(f_approx, v_small, 0, 2).removeO()",
      "expected_linear = f * (1 + v_small/v_wave)",
      "assert sp.simplify(f_series - expected_linear) == 0"
    ]
  },
  "domain": "physics.class-ph",
  "theory_status": "current",
  "validity_regime": {
    "conditions": [
      "Classical wave mechanics",
      "Well-defined medium with constant wave speed",
      "Non-relativistic velocities",
      "Linear wave propagation"
    ],
    "limitations": [
      "Does not apply to electromagnetic waves in vacuum",
      "Breaks down at relativistic speeds",
      "Requires medium for wave propagation",
      "Assumes linear motion along source-observer line"
    ]
  },
  "historical_context": {
    "importance": "Fundamental wave phenomenon with applications in acoustics, radar, medical imaging, and astronomy",
    "development_period": "1842",
    "key_insights": [
      "Wave frequency dependence on motion",
      "Relative motion effects",
      "Foundation for many measurement techniques",
      "Distinction from relativistic effects"
    ]
  },
  "references": [
    {
      "id": "R1",
      "citation": "Doppler, C. (1842). Über das farbige Licht der Doppelsterne und einiger anderer Gestirne des Himmels. *Abhandlungen der Königl. Böhm. Gesellschaft der Wissenschaften*, 2, 465-482."
    },
    {
      "id": "R2",
      "citation": "Resnick, R., Halliday, D., & Krane, K. S. (2001). *Physics* (5th ed.). Wiley."
    }
  ],
  "dependencies": [
    "wave_equation"
  ],
  "created_by": "TheorIA Dataset Expansion",
  "review_status": "draft"
}