{
  "result_id": "larmor_formula",
  "result_name": "Larmor Formula",
  "result_equations": [
    {
      "id": "larmor_power",
      "equation": "P = (2*e^2*a^2)/(3*4*pi*epsilon_0*c^3)"
    },
    {
      "id": "larmor_cgs",
      "equation": "P = (2*e^2*a^2)/(3*c^3)"
    },
    {
      "id": "radiated_energy_rate",
      "equation": "dE/dt = (2*e^2*a^2)/(3*4*pi*epsilon_0*c^3)"
    }
  ],
  "explanation": "The Larmor formula describes the power radiated by a non-relativistic accelerating point charge. It shows that any accelerating charge emits electromagnetic radiation, with power proportional to the square of acceleration. This fundamental result explains energy loss in accelerating electrons, the instability of classical atomic models, and forms the basis for understanding synchrotron radiation, antenna theory, and electromagnetic braking.",
  "equations_assumptions": [
    {
      "id": "eq_assump1",
      "text": "Non-relativistic motion (v << c)."
    },
    {
      "id": "eq_assump2",
      "text": "Point charge approximation."
    },
    {
      "id": "eq_assump3",
      "text": "Far-field radiation (observation distance >> wavelength)."
    },
    {
      "id": "eq_assump4",
      "text": "Classical electrodynamics applies."
    }
  ],
  "definitions": [
    {
      "symbol": "P",
      "definition": "Total radiated power."
    },
    {
      "symbol": "e",
      "definition": "Elementary charge (1.602 × 10⁻¹⁹ C)."
    },
    {
      "symbol": "a",
      "definition": "Magnitude of acceleration of the charge."
    },
    {
      "symbol": "epsilon_0",
      "definition": "Permittivity of free space (8.854 × 10⁻¹² F/m)."
    },
    {
      "symbol": "c",
      "definition": "Speed of light in vacuum."
    }
  ],
  "derivation": [
    {
      "step": 1,
      "equation": "text(Start with retarded electric field of accelerating charge)"
    },
    {
      "step": 2,
      "equation": "vec E = (e/(4*pi*epsilon_0)) * (vec a times (vec n times vec a))/(c^2*R) * (1/(1 - vec n cdot vec v/c))"
    },
    {
      "step": 3,
      "equation": "text(Non-relativistic limit: ) vec v << c"
    },
    {
      "step": 4,
      "equation": "vec E ≈ (e/(4*pi*epsilon_0)) * (vec n times (vec n times vec a))/(c^2*R)"
    },
    {
      "step": 5,
      "equation": "text(Express in terms of angle θ from acceleration direction)"
    },
    {
      "step": 6,
      "equation": "|vec E| = (e*a*sin(theta))/(4*pi*epsilon_0*c^2*R)"
    },
    {
      "step": 7,
      "equation": "text(Poynting vector for radiated power density)"
    },
    {
      "step": 8,
      "equation": "vec S = (1/mu_0) * vec E times vec B = (epsilon_0*c/mu_0) * |vec E|^2 * hat r"
    },
    {
      "step": 9,
      "equation": "|vec S| = (e^2*a^2*sin^2(theta))/(16*pi^2*epsilon_0*c^3*R^2)"
    },
    {
      "step": 10,
      "equation": "text(Integrate over solid angle to get total power)"
    },
    {
      "step": 11,
      "equation": "P = int |vec S| * R^2 * domega = int_0^(2*pi) int_0^pi |vec S| * R^2 * sin(theta) * dtheta * dphi"
    },
    {
      "step": 12,
      "equation": "P = (e^2*a^2)/(8*pi*epsilon_0*c^3) * int_0^pi sin^3(theta) * dtheta"
    },
    {
      "step": 13,
      "equation": "int_0^pi sin^3(theta) * dtheta = 4/3"
    },
    {
      "step": 14,
      "equation": "P = (2*e^2*a^2)/(3*4*pi*epsilon_0*c^3)"
    }
  ],
  "derivation_assumptions": [
    {
      "id": "assumption1",
      "text": "The charge undergoes non-relativistic motion."
    },
    {
      "id": "assumption2",
      "text": "Radiation is observed in the far-field zone."
    },
    {
      "id": "assumption3",
      "text": "Classical electromagnetic theory is valid."
    },
    {
      "id": "assumption4",
      "text": "The charge is a point source."
    }
  ],
  "derivation_explanation": [
    {
      "step": 1,
      "text": "Begin with the general expression for the electric field of an accelerating charge."
    },
    {
      "step": 2,
      "text": "Write the full relativistic expression for the radiated electric field."
    },
    {
      "step": 3,
      "text": "Apply the non-relativistic approximation where velocity is much less than c."
    },
    {
      "step": 4,
      "text": "Simplify the electric field expression for non-relativistic motion."
    },
    {
      "step": 5,
      "text": "Use spherical coordinates with θ measured from the acceleration direction."
    },
    {
      "step": 6,
      "text": "Express the electric field magnitude in terms of the angle θ."
    },
    {
      "step": 7,
      "text": "Use the Poynting vector to find the power flow per unit area."
    },
    {
      "step": 8,
      "text": "Calculate the Poynting vector magnitude from E and B fields."
    },
    {
      "step": 9,
      "text": "Express the power density in terms of distance and angle."
    },
    {
      "step": 10,
      "text": "Set up the integral over all solid angles to find total radiated power."
    },
    {
      "step": 11,
      "text": "Write the power integral in spherical coordinates."
    },
    {
      "step": 12,
      "text": "Factor out constants and identify the angular integral."
    },
    {
      "step": 13,
      "text": "Evaluate the integral of sin³θ from 0 to π."
    },
    {
      "step": 14,
      "text": "Combine all factors to obtain the Larmor formula."
    }
  ],
  "programmatic_verification": {
    "language": "python 3.11.12",
    "library": "sympy 1.12.0",
    "code": [
      "import sympy as sp",
      "import math",
      "",
      "# Define symbols",
      "e, a, epsilon_0, c, mu_0 = sp.symbols('e a epsilon_0 c mu_0', positive=True, real=True)",
      "P, theta = sp.symbols('P theta', real=True)",
      "",
      "# Larmor formula",
      "P_larmor = (2*e**2*a**2)/(3*4*sp.pi*epsilon_0*c**3)",
      "",
      "# Verify the angular integral: ∫₀^π sin³θ dθ = 4/3",
      "integral_sin3 = sp.integrate(sp.sin(theta)**3, (theta, 0, sp.pi))",
      "expected_integral = sp.Rational(4, 3)",
      "assert sp.simplify(integral_sin3 - expected_integral) == 0",
      "",
      "# Test with physical constants",
      "e_val = 1.602e-19       # C (elementary charge)",
      "epsilon_0_val = 8.854e-12  # F/m (permittivity)",
      "c_val = 2.998e8        # m/s (speed of light)",
      "",
      "# Example: Electron in circular orbit (Bohr model)",
      "# For hydrogen ground state orbit",
      "r_bohr = 5.29e-11      # m (Bohr radius)",
      "v_orbital = 2.19e6     # m/s (orbital velocity)",
      "a_centripetal = v_orbital**2 / r_bohr  # centripetal acceleration",
      "",
      "# Calculate radiated power",
      "P_electron = (2*e_val**2*a_centripetal**2)/(3*4*math.pi*epsilon_0_val*c_val**3)",
      "",
      "# Calculate expected power for comparison",
      "# Classical Bohr atom radiated power is approximately 4.7 × 10⁻⁸ W",
      "expected_power = 4.7e-8  # W (corrected value)",
      "relative_error = abs(P_electron - expected_power) / expected_power",
      "# Allow reasonable error due to approximations in classical model",
      "assert relative_error < 0.5, f'Power calculation error: {relative_error}'",
      "",
      "# Test scaling relationships",
      "# Power should scale as a²",
      "a1, a2 = 1.0, 2.0  # arbitrary units",
      "P1 = (2*e_val**2*a1**2)/(3*4*math.pi*epsilon_0_val*c_val**3)",
      "P2 = (2*e_val**2*a2**2)/(3*4*math.pi*epsilon_0_val*c_val**3)",
      "power_ratio = P2 / P1",
      "expected_ratio = (a2/a1)**2",
      "assert abs(power_ratio - expected_ratio) < 1e-10, 'Quadratic scaling with acceleration failed'",
      "",
      "# Test dimensional analysis",
      "# [P] = [e]²[a]²/([ε₀][c]³) should have dimensions of power (ML²T⁻³)",
      "# [e] = AT, [a] = LT⁻², [ε₀] = A²T⁴M⁻¹L⁻³, [c] = LT⁻¹",
      "# [e]²[a]²/([ε₀][c]³) = (AT)²(LT⁻²)²/((A²T⁴M⁻¹L⁻³)(LT⁻¹)³)",
      "# = A²T²L²T⁻⁴/(A²T⁴M⁻¹L⁻³L³T⁻³) = A²L²T⁻²/(A²TM⁻¹) = ML²T⁻³ ✓",
      "",
      "# Test CGS units version",
      "# In CGS: P = (2e²a²)/(3c³)",
      "# Conversion factor between SI and CGS should be consistent",
      "# CGS: e in statcoulomb, a in cm/s², c in cm/s",
      "# SI to CGS conversion involves factors of 4πε₀"
    ]
  },
  "domain": "physics.class-ph",
  "theory_status": "current",
  "validity_regime": {
    "conditions": [
      "Non-relativistic motion (v << c)",
      "Point charge approximation",
      "Classical electrodynamics",
      "Far-field observation"
    ],
    "limitations": [
      "Relativistic corrections needed for high velocities",
      "Finite size effects for extended charges",
      "Quantum effects ignored",
      "Radiation reaction effects not included"
    ]
  },
  "historical_context": {
    "importance": "Fundamental formula for electromagnetic radiation, explains classical electron instability and forms basis for antenna theory and synchrotron radiation",
    "development_period": "1897",
    "key_insights": [
      "Joseph Larmor derived the formula for radiated power",
      "Showed that accelerating charges must radiate energy",
      "Led to recognition of classical atom instability",
      "Foundation for understanding electromagnetic radiation"
    ]
  },
  "references": [
    {
      "id": "R1",
      "citation": "Larmor, J. (1897). 'A Dynamical Theory of the Electric and Luminiferous Medium.' Philosophical Transactions of the Royal Society A, 190, 205-300."
    },
    {
      "id": "R2",
      "citation": "Jackson, J. D. (1998). *Classical Electrodynamics* (3rd ed.). Wiley."
    }
  ],
  "dependencies": [
    "electromagnetic_waves",
    "poynting_vector"
  ],
  "created_by":  "Synthetic entry, created with AI, may have mistakes. Looking for contributors to review all fields",
  "review_status": "draft"
}